{
  "schema_version": "1.0.0",
  "registry_id": "VAIXLNS-OFFICE-FABRIC",
  "canonical_owner": "VAIXLNS",
  "status": "PROPOSED_IMPLEMENTATION_SEED",
  "as_of_date": "2026-10-09",
  "semantics": {
    "office_definition": "A logical engineering office is a bounded responsibility and routing domain, not a physical office or an independently privileged agent. It coordinates systems, tools, contracts, evidence, and handoffs.",
    "zero_loss": true,
    "no_implicit_admission": true,
    "unverified_identity_rule": "Repository-name similarity never resolves system identity. VLNS/NAXLNS and NEXNET/NEXENT remain separate unresolved mappings until explicit evidence is attached.",
    "external_execution_boundary": "External models, APIs, servers, repositories, databases, devices, and tools must pass the VAIXLNS Universal External Integration Gate and VX policy boundary before execution. This registry does not grant credentials or runtime authority."
  },
  "offices": [
    {
      "office_id": "OFF-CANONICAL-GOVERNANCE",
      "name": "Canonical Governance & Master Registry Office",
      "purpose": "Own canonical identities, policy references, architecture state, repository classification, and explicit admission records.",
      "owner_system_ids": [
        "SYS-VAIXLNS",
        "SYS-NEXUS-LNS"
      ],
      "tool_ids": [
        "TOOL-MASTER-REGISTRY",
        "TOOL-REPOSITORY-INVENTORY"
      ],
      "authority_ceiling": "May classify and prepare governance records; canonical promotion or runtime admission requires the defined governance and proof gates.",
      "status": "ACTIVE_REFERENCE",
      "inputs": [
        "system identity proposals",
        "repository inventory changes",
        "integration evidence packages",
        "version and lineage records"
      ],
      "outputs": [
        "canonical registry updates",
        "identity conflict holds",
        "admission decisions",
        "lineage links"
      ],
      "handoff_rules": [
        "No name-only merge or rename.",
        "Every promotion must preserve source identity, evidence, version, and lineage.",
        "Unknown evidence keeps the item in HOLD or UNVERIFIED."
      ],
      "source_refs": [
        "SRC-VAIXLNS-INTEROP",
        "SRC-UNIVERSAL-GATE",
        "SRC-REPOSITORY-INVENTORY",
        "SRC-FEDERATION-INDEX"
      ]
    },
    {
      "office_id": "OFF-RESEARCH-DISCOVERY",
      "name": "Research & System Discovery Office",
      "purpose": "Discover sources, systems, tools, capability gaps, candidate architectures, contradictions, and evidence lineage.",
      "owner_system_ids": [
        "SYS-NEXENT",
        "SYS-VLNS"
      ],
      "tool_ids": [
        "TOOL-NEXENT-ARCH-SEARCH",
        "TOOL-WEB-RESEARCH-ADAPTER",
        "TOOL-GITHUB-ADAPTER"
      ],
      "authority_ceiling": "Research, retrieval, comparison, and proposal only; cannot self-admit research findings or modify canonical state.",
      "status": "PARTIAL_EVIDENCE",
      "inputs": [
        "research objective",
        "search scope",
        "candidate systems",
        "archive and repository sources"
      ],
      "outputs": [
        "source-backed discovery records",
        "candidate system graph",
        "gap register",
        "uncertainty and contradiction report"
      ],
      "handoff_rules": [
        "Cite source URI and revision when available.",
        "Mark reconstructed/inferred claims distinctly from directly observed repository evidence.",
        "Missing search adapters must produce NOT_CONFIGURED/HOLD, not invented results."
      ],
      "source_refs": [
        "SRC-NEXENT-ARCHITECTURE",
        "SRC-NEXENT-INTERFACES",
        "SRC-DISCOVERY-ROUTING"
      ]
    },
    {
      "office_id": "OFF-INTELLIGENCE-PLANNING",
      "name": "Intelligence, Decomposition & Planning Office",
      "purpose": "Translate intents and discoveries into decomposed tasks, typed plans, candidate solutions, and handoff envelopes.",
      "owner_system_ids": [
        "SYS-XV",
        "SYS-NEXENT",
        "SYS-VX-AGENTS-FABRIC"
      ],
      "tool_ids": [
        "TOOL-NEXENT-ARCH-SEARCH"
      ],
      "authority_ceiling": "May plan and recommend; execution remains subject to VX capabilities, policy, and scoped authorization.",
      "status": "SPECIFIED",
      "inputs": [
        "intent",
        "constraints",
        "capability requirements",
        "evidence and risk summaries"
      ],
      "outputs": [
        "dependency plan",
        "candidate architecture",
        "bounded work packages",
        "acceptance criteria"
      ],
      "handoff_rules": [
        "Separate planning from execution.",
        "Attach budget, expected state transition, risk, and evidence obligations to every executable proposal.",
        "Do not treat agent consensus as proof."
      ],
      "source_refs": [
        "SRC-SYSTEM-CONTEXT",
        "SRC-NEXENT-ARCHITECTURE",
        "SRC-AGENT-FABRIC-CONTRACT"
      ]
    },
    {
      "office_id": "OFF-EXECUTION-RUNTIME",
      "name": "VX Execution & Runtime Office",
      "purpose": "Provide the governed execution boundary for admitted actions, typed adapters, event/state/ledger effects, and controlled recovery.",
      "owner_system_ids": [
        "SYS-VX-RUNTIME",
        "SYS-VX-UNIFIED",
        "SYS-VAIXLNS-CORE",
        "SYS-CSD-KERNEL"
      ],
      "tool_ids": [
        "TOOL-VX-ADMISSION-GATE",
        "TOOL-DISCOVERY-ROUTER"
      ],
      "authority_ceiling": "Only explicitly admitted operations with a valid capability contract, policy approval, resource budget, and required evidence hooks.",
      "status": "PARTIAL_EVIDENCE",
      "inputs": [
        "authorized execution object",
        "contract-valid request",
        "approved adapter",
        "resource and deadline limits"
      ],
      "outputs": [
        "execution result",
        "events and state changes",
        "failure/recovery records",
        "evidence package"
      ],
      "handoff_rules": [
        "No direct external action before VX policy gating.",
        "Timeouts and partial failures must remain observable and resumable by stable task ID.",
        "Physical-system adapters default to observe/simulate."
      ],
      "source_refs": [
        "SRC-VAIXLNS-INTEROP",
        "SRC-UNIVERSAL-GATE",
        "SRC-SYSTEM-CONTEXT",
        "SRC-DISCOVERY-ROUTING"
      ]
    },
    {
      "office_id": "OFF-KNOWLEDGE-LINEAGE",
      "name": "Knowledge, Nexus & Lineage Office",
      "purpose": "Maintain resolvable system, capability, file, artifact, evidence, dependency, and temporal relationships without losing legacy identities.",
      "owner_system_ids": [
        "SYS-NEXUS-LNS",
        "SYS-VAIXLNS",
        "SYS-VLNS"
      ],
      "tool_ids": [
        "TOOL-MASTER-REGISTRY",
        "TOOL-REPOSITORY-INVENTORY"
      ],
      "authority_ceiling": "Index and relationship maintenance only; cannot infer unresolved identity equivalence as canonical fact.",
      "status": "SPECIFIED",
      "inputs": [
        "repository metadata",
        "archive fragments",
        "artifact IDs",
        "events",
        "source references"
      ],
      "outputs": [
        "identity graph",
        "lineage graph",
        "dependency graph",
        "traceable index entries"
      ],
      "handoff_rules": [
        "Preserve aliases and historical IDs.",
        "Use explicit relationship types rather than destructive merges.",
        "Mark source gaps and identity conflicts in the graph."
      ],
      "source_refs": [
        "SRC-SYSTEM-CONTEXT",
        "SRC-REPOSITORY-INVENTORY",
        "SRC-FEDERATION-INDEX"
      ]
    },
    {
      "office_id": "OFF-VERIFICATION-PROOF",
      "name": "Verification, Evidence & Proof Office",
      "purpose": "Check contracts, conformance, falsification cases, evidence freshness, reproducibility, and proof obligations.",
      "owner_system_ids": [
        "SYS-VV",
        "SYS-ARCX",
        "SYS-VAIXLNS"
      ],
      "tool_ids": [
        "TOOL-ARCX-PROOF",
        "TOOL-SERVER-DISCOVERY-PROBE"
      ],
      "authority_ceiling": "May verify and report; cannot grant its own execution authority or promote its own candidate.",
      "status": "PARTIAL_EVIDENCE",
      "inputs": [
        "candidate artifact",
        "contract",
        "test cases",
        "environment fingerprint",
        "evidence references"
      ],
      "outputs": [
        "verification report",
        "failed obligations",
        "freshness result",
        "promotion recommendation"
      ],
      "handoff_rules": [
        "Evidence is not proof until obligations are checked.",
        "A reachable endpoint is not evidence of service correctness.",
        "Missing observations force an explicit unobservable/hold result."
      ],
      "source_refs": [
        "SRC-UNIVERSAL-GATE",
        "SRC-VAIXLNS-INTEROP",
        "SRC-ARCX-TOOL"
      ]
    },
    {
      "office_id": "OFF-OPERATIONS-RECOVERY",
      "name": "Operations, Observability & Recovery Office",
      "purpose": "Correlate runtime health, events, state, ledger, replay, recovery, capacity, and operational assurance.",
      "owner_system_ids": [
        "SYS-OIF",
        "SYS-VX-RUNTIME",
        "SYS-VX-UNIFIED"
      ],
      "tool_ids": [
        "TOOL-SERVER-DISCOVERY-PROBE",
        "TOOL-OTEL-OBSERVABILITY"
      ],
      "authority_ceiling": "Read/observe by default; recovery actions require explicit VX authority and runbook-defined scope.",
      "status": "SPECIFIED",
      "inputs": [
        "runtime events",
        "health checks",
        "resource metrics",
        "failure and replay records"
      ],
      "outputs": [
        "correlated trace",
        "incident record",
        "recovery proposal",
        "operational readiness evidence"
      ],
      "handoff_rules": [
        "Use a shared trace/task ID across offices.",